{
  "kind": "ModuleContract",
  "id": "module.patch.emit",
  "version": "1",
  "ports": {
    "input": {
      "plan": {
        "artifact_type": "artifact.implementation_plan@1",
        "required": true
      },
      "snapshot": {
        "artifact_type": "artifact.project_snapshot@1",
        "required": true
      }
    },
    "output": {
      "patch_manifest": {
        "artifact_type": "artifact.patch_manifest@1"
      }
    }
  },
  "requires": {
    "capabilities": [
      {
        "id": "cap.fs.read",
        "scope": [
          "project/**"
        ]
      }
    ],
    "context": [
      "run_id",
      "trace_sink"
    ]
  },
  "effects": {
    "fs_read": [
      "project/**"
    ],
    "fs_write": [],
    "network": false,
    "provider_call": false,
    "risk": 2
  },
  "compatibility": {
    "replaceable": true,
    "movable": true,
    "surface_rule": "same_or_compatible",
    "effect_rule": "subset_or_equal"
  },
  "source_trace": {
    "candidate": "candidate.patch_manifest_generation",
    "legacy_files": [
      "AGENTS.md",
      "README.md",
      "apps/project_backend/application/delivery_evidence.py"
    ],
    "legacy_symbols": [
      "AgentManifestGeneratorTests",
      "DeliveryEvidenceManifest",
      "EXPORT_MANIFEST_SCHEMA"
    ],
    "evidence_keywords": [
      "manifest",
      "patch_manifest"
    ]
  }
}
