{
  "kind": "ModuleContract",
  "id": "module.delivery.package",
  "version": "1",
  "ports": {
    "input": {
      "validation_report": {
        "artifact_type": "artifact.validation_report@1",
        "required": true
      }
    },
    "output": {
      "delivery_package": {
        "artifact_type": "artifact.delivery_package@1"
      }
    }
  },
  "requires": {
    "capabilities": [],
    "context": [
      "run_id",
      "trace_sink"
    ]
  },
  "effects": {
    "fs_read": [],
    "fs_write": [],
    "network": false,
    "provider_call": false,
    "risk": 1
  },
  "compatibility": {
    "replaceable": true,
    "movable": true,
    "surface_rule": "same_or_compatible",
    "effect_rule": "subset_or_equal"
  },
  "metadata": {
    "requires_delivery_ready_truth": true
  }
}
